{"artifact_kind":"simulation_decision_comparison","assurance":{"bellman_certificate":false,"causal_result":false,"model_empirically_validated":false,"model_output_check":"fresh_exact_integer_fifo_trace","objective_check":"fresh_exact_integer_arithmetic","objective_empirically_identified":false,"recommendation_authorizes_action":false},"claim":"conditional_minimum_loss_over_declared_options","comparison_id":"comparison.synthetic-charging.base-service-9","completed_at":"2026-10-06T08:00:00Z","evidence_kind":"model_generated_with_supplied_preferences","objective":{"loss_unit":"stipulated_loss_point","mapping":"total_loss=wait_weight*total_wait+fixed_cost","output_metric":"total_wait","output_unit":"minute","preference_statement":"For this synthetic comparison only, one total simulated waiting minute counts as one stipulated loss point; fixed option burdens are 0, 4 and 7 stipulated loss points.","rounding":"none_exact_integer_arithmetic","sense":"minimize","tolerance":"0","wait_weight":{"unit":"stipulated_loss_point_per_minute","value":"1"}},"option_class":{"declared_menu_completeness":"complete","real_world_option_completeness":"not_established","scope_statement":"Exactly retain, streamline and intensive for this synthetic two-server FIFO menu; no claim covers other capacities, schedules or real policies."},"options":[{"action_id":"use_intensive_process","description":"Apply the supplied intensive-process assumption, four minutes below base service.","fixed_cost":{"unit":"stipulated_loss_point","value":"7"},"input_sha256":"sha256:df06bb93064a29a7637c32c94dbfed9f6d6615b692a97d093b1ca54af3a3a92a","option_id":"intensive","run":{"content":"eyJhcnRpZmFjdF9raW5kIjoiZXh0ZXJuYWxfc2ltdWxhdGlvbl9ydW4iLCJhc3N1bXB0aW9ucyI6WyJpbml0aWFsbHlfZW1wdHkiLCJmaWZvIiwidHdvX2lkZW50aWNhbF9zZXJ2ZXJzIiwiY29uc3RhbnRfc2VydmljZSIsIm5vX2FiYW5kb25tZW50IiwiZGV0ZXJtaW5pc3RpY19hcnJpdmFscyJdLCJjbGFpbSI6ImZpbml0ZV90cmFjZV91bmRlcl9zdXBwbGllZF9pbnB1dHMiLCJldmlkZW5jZV9raW5kIjoibW9kZWxfZ2VuZXJhdGVkIiwiaW5wdXRzIjp7ImNvbnRlbnQiOiJleUpoY25KcGRtRnNjeUk2V3lJd0lpd2lNaUlzSWpRaUxDSTJJbDBzSW5ObGNuWnBZMlZmYldsdWRYUmxjeUk2SWpVaUxDSjFibWwwSWpvaWJXbHVkWFJsSW4wSyIsImVuY29kaW5nIjoiYmFzZTY0Iiwic2hhMjU2Ijoic2hhMjU2OmRmMDZiYjkzMDY0YTI5YTc2MzdjMzJjOTRkYmZlZDlmNmQ2NjE1YjY5MmE5N2QwOTNiMWNhNTRhZjNhM2E5MmEifSwibW9kZWwiOnsiY29udGVudCI6IklpSWlRV1JoY0hSbFpDQm1jbTl0SUZOcGJWQjVJRFF1TVM0eElITm9ZWEpsWkY5eVpYTnZkWEpqWlhNdWNuTjBJQ2hOU1ZRN0lITmxaU0JNU1VORlRsTkZMbk5wYlhCNUxuUjRkQ2t1Q2dwVGFXMVFlU0J2ZDI1eklHVjJaVzUwSUhOamFHVmtkV3hwYm1jZ1lXNWtJSEpsYzI5MWNtTmxJR0ZqY1hWcGMybDBhVzl1TGlCVWFHbHpJR0ZrWVhCMFpYSWdjM1Z3Y0d4cFpYTWdaWGh3YkdsamFYUUthVzUwWldkbGNpQnBibkIxZEhNZ1lXNWtJSEpsWTI5eVpITWdkR2hsSUhKbGMzVnNkR2x1WnlCd1pYSXRZMkZ5SUhSeVlXTmxPeUJwZENCcGJYQnNaVzFsYm5SeklHNXZJSE5wYlhWc1lYUnZjaTRLSWlJaUNtbHRjRzl5ZENCcWMyOXVDbWx0Y0c5eWRDQnplWE1LQ21sdGNHOXlkQ0J6YVcxd2VRb0tDbVJsWmlCeWRXNG9hVzV3ZFhSektUb0tJQ0FnSUdWdWRpQTlJSE5wYlhCNUxrVnVkbWx5YjI1dFpXNTBLQ2tLSUNBZ0lISmxjMjkxY21ObElEMGdjMmx0Y0hrdVVtVnpiM1Z5WTJVb1pXNTJMQ0JqWVhCaFkybDBlVDB5S1FvZ0lDQWdjbTkzY3lBOUlGdE9iMjVsWFNBcUlHeGxiaWhwYm5CMWRITmJJbUZ5Y21sMllXeHpJbDBwQ2dvZ0lDQWdaR1ZtSUdOaGNpaHBibVJsZUN3Z1lYSnlhWFpoYkNrNkNpQWdJQ0FnSUNBZ2VXbGxiR1FnWlc1MkxuUnBiV1Z2ZFhRb1lYSnlhWFpoYkNrS0lDQWdJQ0FnSUNCM2FYUm9JSEpsYzI5MWNtTmxMbkpsY1hWbGMzUW9LU0JoY3lCeVpYRjFaWE4wT2dvZ0lDQWdJQ0FnSUNBZ0lDQjVhV1ZzWkNCeVpYRjFaWE4wQ2lBZ0lDQWdJQ0FnSUNBZ0lITjBZWEowSUQwZ1pXNTJMbTV2ZHdvZ0lDQWdJQ0FnSUNBZ0lDQjVhV1ZzWkNCbGJuWXVkR2x0Wlc5MWRDaHBiblFvYVc1d2RYUnpXeUp6WlhKMmFXTmxYMjFwYm5WMFpYTWlYU2twQ2lBZ0lDQWdJQ0FnSUNBZ0lISnZkM05iYVc1a1pYaGRJRDBnZXlKallYSWlPaUJ6ZEhJb2FXNWtaWGdwTENBaVlYSnlhWFpoYkNJNklITjBjaWhoY25KcGRtRnNLU3dLSUNBZ0lDQWdJQ0FnSUNBZ0lDQWdJQ0FnSUNBZ0lDQWdJQ0FnSW5OMFlYSjBJam9nYzNSeUtITjBZWEowS1N3Z0ltWnBibWx6YUNJNklITjBjaWhsYm5ZdWJtOTNLWDBLQ2lBZ0lDQm1iM0lnYVc1a1pYZ3NJR0Z5Y21sMllXd2dhVzRnWlc1MWJXVnlZWFJsS0dsdWNIVjBjMXNpWVhKeWFYWmhiSE1pWFNrNkNpQWdJQ0FnSUNBZ1pXNTJMbkJ5YjJObGMzTW9ZMkZ5S0dsdVpHVjRMQ0JwYm5Rb1lYSnlhWFpoYkNrcEtRb2dJQ0FnWlc1MkxuSjFiaWdwQ2lBZ0lDQnlaWFIxY200Z2V5SjFibWwwSWpvZ0ltMXBiblYwWlNJc0lDSnliM2R6SWpvZ2NtOTNjMzBLQ2dwcFppQmZYMjVoYldWZlh5QTlQU0FpWDE5dFlXbHVYMThpT2dvZ0lDQWdkMmwwYUNCdmNHVnVLSE41Y3k1aGNtZDJXekZkTENBaWNtSWlLU0JoY3lCemIzVnlZMlU2Q2lBZ0lDQWdJQ0FnYVc1d2RYUnpJRDBnYW5OdmJpNXNiMkZrS0hOdmRYSmpaU2tLSUNBZ0lIQnlhVzUwS0dwemIyNHVaSFZ0Y0hNb2NuVnVLR2x1Y0hWMGN5a3NJSE52Y25SZmEyVjVjejFVY25WbExDQnpaWEJoY21GMGIzSnpQU2dpTENJc0lDSTZJaWtwS1FvPSIsImVuY29kaW5nIjoiYmFzZTY0Iiwic2hhMjU2Ijoic2hhMjU2OjIyYjc2ZjI2Yjg3NGM1NmJmMTM2ZGYwNDcyZDQ0N2NlODVlZWM1ODRjMjc3ZWU4NTNjNWVkNTYyNWIyMDU4OTgifSwib3V0cHV0Ijp7ImNvbnRlbnQiOiJleUp5YjNkeklqcGJleUpoY25KcGRtRnNJam9pTUNJc0ltTmhjaUk2SWpBaUxDSm1hVzVwYzJnaU9pSTFJaXdpYzNSaGNuUWlPaUl3SW4wc2V5SmhjbkpwZG1Gc0lqb2lNaUlzSW1OaGNpSTZJakVpTENKbWFXNXBjMmdpT2lJM0lpd2ljM1JoY25RaU9pSXlJbjBzZXlKaGNuSnBkbUZzSWpvaU5DSXNJbU5oY2lJNklqSWlMQ0ptYVc1cGMyZ2lPaUl4TUNJc0luTjBZWEowSWpvaU5TSjlMSHNpWVhKeWFYWmhiQ0k2SWpZaUxDSmpZWElpT2lJeklpd2labWx1YVhOb0lqb2lNVElpTENKemRHRnlkQ0k2SWpjaWZWMHNJblZ1YVhRaU9pSnRhVzUxZEdVaWZRbz0iLCJlbmNvZGluZyI6ImJhc2U2NCIsInNoYTI1NiI6InNoYTI1NjpjMGMxOWE5MmI1MzYyMGFiYzFmMjM4YmU2NmJiMDljMDAxMWUzNzQzYzZlNTU5OWFjYmVmZWU5YzYyMDY1M2IzIn0sInBhY2thZ2UiOnsibmFtZSI6InNpbXB5Iiwic2Rpc3Rfc2hhMjU2Ijoic2hhMjU2OjA2ZDA3NTBhNzg4NGIxMWUwZThlMjBjZTBiYzdjNmQ0ZWQ1ZjE3NDNkNDU2Njk1MzQwZDEzZmRmZjk1MDAxYTYiLCJzb3VyY2VfbWFuaWZlc3QiOnsic2ltcHkvX19pbml0X18ucHkiOiJzaGEyNTY6OWExNWFkNDQxYjRlMWM1OWIxMzkxYzY5OGY1MTJjYWViNTQ3ZWU5MzZjOTZkNjMzZjJmODQxYzEwY2QzYTI0NiIsInNpbXB5L2NvcmUucHkiOiJzaGEyNTY6MDI3NGIzNmQ5ZGRhNWMwOTAxYjhkNzY1ODg1NzA1YmJlNzY2NDBlMjRkYTFiYzYzZTY3OTQzM2UwZjljNDlkZCIsInNpbXB5L2V2ZW50cy5weSI6InNoYTI1Njo3Y2JhNmU3MTcwOTJjZWUxYjBkNTFlZDMzYjgzYTJmNTFmMDU1ZGMzMzI3Yzg5NGJmOTkxMjJjM2JmYTE2YjRkIiwic2ltcHkvZXhjZXB0aW9ucy5weSI6InNoYTI1Njo5YjI5YTIzY2VlMTg4YmI5NGQ5Y2MwZWEwZGZmOTg5MTZjYWMyNzg5ZmU0ZDYzNzU4MTU5NzZiNjlmOThkYjc2Iiwic2ltcHkvcmVzb3VyY2VzL19faW5pdF9fLnB5Ijoic2hhMjU2Ojg1Mzc2ZDIxOGY4NTJhNzY2NDI3ZDEwNzQzNzlhYTc5Yjc2YmJiZmE3NDZkNDk2ZjhiZGZmNjYyMWMyNTQyNTUiLCJzaW1weS9yZXNvdXJjZXMvYmFzZS5weSI6InNoYTI1NjoyMGRjOTAzODYxYTM4MmI0Mjc3MmM5ZGFlYzdhZDc5YWU5ZmM4N2QwNzYzNDFiZDNmMzI5N2RkNmMzNGQxZGExIiwic2ltcHkvcmVzb3VyY2VzL2NvbnRhaW5lci5weSI6InNoYTI1NjoyNzIxZGFjZDE2ZmU0NmMzZmMxZmYwMjdjZDY1YWU4ZjVmMDkwYTFlYWYzODUwYmI3ZWIyZWM3NzhlMzdmM2JkIiwic2ltcHkvcmVzb3VyY2VzL3Jlc291cmNlLnB5Ijoic2hhMjU2OmUxODRmYjZhYjUxOGQyMzU1MmY4YWMxYjA1ZmI1MmFkODU0ZjUwNDVhNjI4MTRlNTMxZjZjYTQzNTMyMDRlMDUiLCJzaW1weS9yZXNvdXJjZXMvc3RvcmUucHkiOiJzaGEyNTY6NTczMTA2NmQwMTI2ZmQ2OGMxZWU3OThhMjM5MjdhNjVkNGViZjE0YzdlODliZmNlNWNlNzAzNDk0Yzc3YmJlNyIsInNpbXB5L3J0LnB5Ijoic2hhMjU2OjZkNTFkOTBhMGJhZGM2ZDA4ZDBiZGJjNjdmZmU1ODkzOThhZjBiZDQzMGJiNzRjNDZmMGNkZGFiZmY2ZDJiNmQiLCJzaW1weS91dGlsLnB5Ijoic2hhMjU2OmU0MjcwYjExYjc0M2ZmNGZkMWZhYjg2YmZmMDhhOWI0NjQyMTlhMDIxOTBkOTcyNWNmNmQ4NzAwNjYwM2Y0OWMifSwidmVyc2lvbiI6IjQuMS4xIn0sInByb2ZpbGUiOiJzaW1weS1yZXNvdXJjZS1maWZvLnYxIiwicnVudGltZSI6eyJpbXBsZW1lbnRhdGlvbiI6IkNQeXRob24iLCJyYW5kb21uZXNzIjoibm9uZSIsInRpbWVfYXJpdGhtZXRpYyI6ImludGVnZXIiLCJ2ZXJzaW9uIjoiMy4xMy4xNSJ9LCJzY2hlbWFfdmVyc2lvbiI6IjAuMS4wIiwidXBzdHJlYW1fZXhhbXBsZV9zaGEyNTYiOiJzaGEyNTY6YTliMjI2NWVjZmYzYWE2NTQyYTc4MTRjZTQxOTI1MmI2MWUxMGFiZWM4NGRhYmE1NTJkNjk2Yzg2NDU3Y2RjZCJ9Cg==","encoding":"base64","sha256":"sha256:aff2e46ccf942f842c0e6fca0524984e0c3b373c1b435092b8e21fb3c31b393e"},"run_sha256":"sha256:aff2e46ccf942f842c0e6fca0524984e0c3b373c1b435092b8e21fb3c31b393e","service_delta_minutes":"-4"},{"action_id":"retain_current_process","description":"Retain the supplied base-service process.","fixed_cost":{"unit":"stipulated_loss_point","value":"0"},"input_sha256":"sha256:9c75ff6d167aa1fedbe712b3a8bf8c3b501f010b3cb7560081214dc0f70e1d6f","option_id":"retain","run":{"content":"eyJhcnRpZmFjdF9raW5kIjoiZXh0ZXJuYWxfc2ltdWxhdGlvbl9ydW4iLCJhc3N1bXB0aW9ucyI6WyJpbml0aWFsbHlfZW1wdHkiLCJmaWZvIiwidHdvX2lkZW50aWNhbF9zZXJ2ZXJzIiwiY29uc3RhbnRfc2VydmljZSIsIm5vX2FiYW5kb25tZW50IiwiZGV0ZXJtaW5pc3RpY19hcnJpdmFscyJdLCJjbGFpbSI6ImZpbml0ZV90cmFjZV91bmRlcl9zdXBwbGllZF9pbnB1dHMiLCJldmlkZW5jZV9raW5kIjoibW9kZWxfZ2VuZXJhdGVkIiwiaW5wdXRzIjp7ImNvbnRlbnQiOiJleUpoY25KcGRtRnNjeUk2V3lJd0lpd2lNaUlzSWpRaUxDSTJJbDBzSW5ObGNuWnBZMlZmYldsdWRYUmxjeUk2SWpraUxDSjFibWwwSWpvaWJXbHVkWFJsSW4wSyIsImVuY29kaW5nIjoiYmFzZTY0Iiwic2hhMjU2Ijoic2hhMjU2OjljNzVmZjZkMTY3YWExZmVkYmU3MTJiM2E4YmY4YzNiNTAxZjAxMGIzY2I3NTYwMDgxMjE0ZGMwZjcwZTFkNmYifSwibW9kZWwiOnsiY29udGVudCI6IklpSWlRV1JoY0hSbFpDQm1jbTl0SUZOcGJWQjVJRFF1TVM0eElITm9ZWEpsWkY5eVpYTnZkWEpqWlhNdWNuTjBJQ2hOU1ZRN0lITmxaU0JNU1VORlRsTkZMbk5wYlhCNUxuUjRkQ2t1Q2dwVGFXMVFlU0J2ZDI1eklHVjJaVzUwSUhOamFHVmtkV3hwYm1jZ1lXNWtJSEpsYzI5MWNtTmxJR0ZqY1hWcGMybDBhVzl1TGlCVWFHbHpJR0ZrWVhCMFpYSWdjM1Z3Y0d4cFpYTWdaWGh3YkdsamFYUUthVzUwWldkbGNpQnBibkIxZEhNZ1lXNWtJSEpsWTI5eVpITWdkR2hsSUhKbGMzVnNkR2x1WnlCd1pYSXRZMkZ5SUhSeVlXTmxPeUJwZENCcGJYQnNaVzFsYm5SeklHNXZJSE5wYlhWc1lYUnZjaTRLSWlJaUNtbHRjRzl5ZENCcWMyOXVDbWx0Y0c5eWRDQnplWE1LQ21sdGNHOXlkQ0J6YVcxd2VRb0tDbVJsWmlCeWRXNG9hVzV3ZFhSektUb0tJQ0FnSUdWdWRpQTlJSE5wYlhCNUxrVnVkbWx5YjI1dFpXNTBLQ2tLSUNBZ0lISmxjMjkxY21ObElEMGdjMmx0Y0hrdVVtVnpiM1Z5WTJVb1pXNTJMQ0JqWVhCaFkybDBlVDB5S1FvZ0lDQWdjbTkzY3lBOUlGdE9iMjVsWFNBcUlHeGxiaWhwYm5CMWRITmJJbUZ5Y21sMllXeHpJbDBwQ2dvZ0lDQWdaR1ZtSUdOaGNpaHBibVJsZUN3Z1lYSnlhWFpoYkNrNkNpQWdJQ0FnSUNBZ2VXbGxiR1FnWlc1MkxuUnBiV1Z2ZFhRb1lYSnlhWFpoYkNrS0lDQWdJQ0FnSUNCM2FYUm9JSEpsYzI5MWNtTmxMbkpsY1hWbGMzUW9LU0JoY3lCeVpYRjFaWE4wT2dvZ0lDQWdJQ0FnSUNBZ0lDQjVhV1ZzWkNCeVpYRjFaWE4wQ2lBZ0lDQWdJQ0FnSUNBZ0lITjBZWEowSUQwZ1pXNTJMbTV2ZHdvZ0lDQWdJQ0FnSUNBZ0lDQjVhV1ZzWkNCbGJuWXVkR2x0Wlc5MWRDaHBiblFvYVc1d2RYUnpXeUp6WlhKMmFXTmxYMjFwYm5WMFpYTWlYU2twQ2lBZ0lDQWdJQ0FnSUNBZ0lISnZkM05iYVc1a1pYaGRJRDBnZXlKallYSWlPaUJ6ZEhJb2FXNWtaWGdwTENBaVlYSnlhWFpoYkNJNklITjBjaWhoY25KcGRtRnNLU3dLSUNBZ0lDQWdJQ0FnSUNBZ0lDQWdJQ0FnSUNBZ0lDQWdJQ0FnSW5OMFlYSjBJam9nYzNSeUtITjBZWEowS1N3Z0ltWnBibWx6YUNJNklITjBjaWhsYm5ZdWJtOTNLWDBLQ2lBZ0lDQm1iM0lnYVc1a1pYZ3NJR0Z5Y21sMllXd2dhVzRnWlc1MWJXVnlZWFJsS0dsdWNIVjBjMXNpWVhKeWFYWmhiSE1pWFNrNkNpQWdJQ0FnSUNBZ1pXNTJMbkJ5YjJObGMzTW9ZMkZ5S0dsdVpHVjRMQ0JwYm5Rb1lYSnlhWFpoYkNrcEtRb2dJQ0FnWlc1MkxuSjFiaWdwQ2lBZ0lDQnlaWFIxY200Z2V5SjFibWwwSWpvZ0ltMXBiblYwWlNJc0lDSnliM2R6SWpvZ2NtOTNjMzBLQ2dwcFppQmZYMjVoYldWZlh5QTlQU0FpWDE5dFlXbHVYMThpT2dvZ0lDQWdkMmwwYUNCdmNHVnVLSE41Y3k1a